{
  "$schema": "https://json-schema.org/draft/2020-12/schema",
  "$id": "https://adr-kit.dev/semantic-contract/resources/architecture-interpretation/1.3/lifecycle-ownership.schema.json",
  "type": "object",
  "additionalProperties": false,
  "required": [
    "resource",
    "source_contract",
    "output_contract",
    "output_authority",
    "semanticDependencies",
    "rules",
    "rows",
    "destination_schema"
  ],
  "properties": {
    "resource": {
      "const": "architecture-interpretation/1.3/lifecycle-ownership"
    },
    "source_contract": {
      "const": "authoring@1.7"
    },
    "output_contract": {
      "const": "normalized-model@2.5"
    },
    "output_authority": {
      "const": {
        "family": "normalized-model",
        "version": "2.5",
        "semantic_contract_fingerprint": "scf:v1:sha256:bb48720502668e434d378445004aec7783346a0e74254c9e0d3cb01a8798d9d7"
      }
    },
    "semanticDependencies": {
      "type": "array",
      "items": {
        "type": "string",
        "minLength": 1
      },
      "uniqueItems": true
    },
    "rules": {
      "const": {
        "lifecycle": "literal_declaring_adr_status",
        "qualification_basis": "independently_verified_sealed_minimal_source_roots",
        "owner_identity": "declaring_ADR_canonical_UUIDv7_from_id",
        "reference_only": "never_a_definition_or_declaring_owner",
        "wildcard_meaning": "schema_items_only_not_runtime_identity_or_order",
        "missing_lifecycle_provenance": "Unavailable",
        "ambiguous_or_competing_established_ownership": "Rejected",
        "unqualified_rule_or_authority": "Unavailable",
        "unresolved_dependency": "Unresolved_only_if_governed_resolution_established_it",
        "partial_interpretation": "never_a_complete_qualified_result",
        "precedence": [
          "Rejected",
          "Unavailable",
          "Unresolved"
        ],
        "not_implied": [
          "implementation",
          "deployment",
          "operation",
          "effectivity",
          "admission",
          "independent_child_approval"
        ],
        "excluded": [
          "entity/normative_proposition",
          "entity/extension",
          "relationship/*",
          "value/*",
          "unqualified_standalone_fragment"
        ],
        "forbidden_owner_derivation": [
          "filename",
          "path",
          "source_pointer",
          "array_index",
          "traversal_order",
          "root_position",
          "request_key",
          "reference"
        ],
        "source_bytes": "unchanged",
        "canonical_identities": "preserved_no_new_identity",
        "additional_composition_bindings": false
      }
    },
    "rows": {
      "type": "array",
      "items": {
        "type": "object",
        "additionalProperties": false,
        "required": [
          "rule_id",
          "declaring_adr_semantic_type",
          "parent_semantic_type",
          "child_semantic_type",
          "source_schema",
          "parent_schema",
          "child_schema",
          "ownership_schema_path",
          "source_instance_pattern",
          "declaring_adr_identity_selector",
          "parent_identity_selector",
          "child_identity_selector",
          "status_semantic_field_key",
          "status_source_authority",
          "governing_rule",
          "value_destination",
          "canonical_identity",
          "shared_system_descriptor"
        ],
        "properties": {
          "rule_id": {
            "type": "string",
            "minLength": 1
          },
          "declaring_adr_semantic_type": {
            "type": "string",
            "minLength": 1
          },
          "parent_semantic_type": {
            "type": "string",
            "minLength": 1
          },
          "child_semantic_type": {
            "type": "string",
            "minLength": 1
          },
          "source_schema": {
            "type": "object",
            "additionalProperties": false,
            "required": [
              "canonical_resource_key",
              "content_digest",
              "schema_pointer"
            ],
            "properties": {
              "canonical_resource_key": {
                "type": "string",
                "minLength": 1
              },
              "content_digest": {
                "type": "string",
                "pattern": "^sha256:[0-9a-f]{64}$"
              },
              "schema_pointer": {
                "type": "string",
                "pattern": "^(?:/.*)?$"
              }
            }
          },
          "parent_schema": {
            "type": "object",
            "additionalProperties": false,
            "required": [
              "canonical_resource_key",
              "content_digest",
              "schema_pointer"
            ],
            "properties": {
              "canonical_resource_key": {
                "type": "string",
                "minLength": 1
              },
              "content_digest": {
                "type": "string",
                "pattern": "^sha256:[0-9a-f]{64}$"
              },
              "schema_pointer": {
                "type": "string",
                "pattern": "^(?:/.*)?$"
              }
            }
          },
          "child_schema": {
            "type": "object",
            "additionalProperties": false,
            "required": [
              "canonical_resource_key",
              "content_digest",
              "schema_pointer"
            ],
            "properties": {
              "canonical_resource_key": {
                "type": "string",
                "minLength": 1
              },
              "content_digest": {
                "type": "string",
                "pattern": "^sha256:[0-9a-f]{64}$"
              },
              "schema_pointer": {
                "type": "string",
                "pattern": "^(?:/.*)?$"
              }
            }
          },
          "ownership_schema_path": {
            "type": "array",
            "items": {
              "type": "object",
              "additionalProperties": false,
              "required": [
                "canonical_resource_key",
                "content_digest",
                "schema_pointer"
              ],
              "properties": {
                "canonical_resource_key": {
                  "type": "string",
                  "minLength": 1
                },
                "content_digest": {
                  "type": "string",
                  "pattern": "^sha256:[0-9a-f]{64}$"
                },
                "schema_pointer": {
                  "type": "string",
                  "pattern": "^(?:/.*)?$"
                }
              }
            },
            "minItems": 1
          },
          "source_instance_pattern": {
            "type": "string",
            "minLength": 1
          },
          "declaring_adr_identity_selector": {
            "const": "/id"
          },
          "parent_identity_selector": {
            "const": "/id"
          },
          "child_identity_selector": {
            "const": "/id"
          },
          "status_semantic_field_key": {
            "type": "string",
            "minLength": 1
          },
          "status_source_authority": {
            "type": "object",
            "additionalProperties": false,
            "required": [
              "family",
              "version",
              "canonical_resource_key",
              "content_digest",
              "schema_pointer"
            ],
            "properties": {
              "family": {
                "const": "authoring"
              },
              "version": {
                "const": "1.7"
              },
              "canonical_resource_key": {
                "type": "string",
                "minLength": 1
              },
              "content_digest": {
                "type": "string",
                "pattern": "^sha256:[0-9a-f]{64}$"
              },
              "schema_pointer": {
                "type": "string",
                "pattern": "^(?:/.*)?$"
              }
            }
          },
          "governing_rule": {
            "const": "literal_declaring_adr_status"
          },
          "value_destination": {
            "const": "/lifecycle_stage"
          },
          "canonical_identity": {
            "const": "preserve_established_uuidv7"
          },
          "shared_system_descriptor": {
            "enum": [
              "not_applicable",
              "reuse_existing_semantic_unit_if_same_canonical_identity"
            ]
          }
        }
      },
      "minItems": 17,
      "maxItems": 17
    },
    "destination_schema": {
      "const": {
        "canonical_resource_key": "normalized-model/2.5/schema/normalized-entity.schema",
        "content_digest": "sha256:4a7f31d35b34b61412e880e7bcc56123fc90f22f9b463ee596b8f80b0a4b40ff",
        "schema_pointer": "/oneOf/0/properties/lifecycle_stage"
      }
    }
  }
}
