{
  "resource": "architecture-interpretation/1.3/lifecycle-ownership",
  "source_contract": "authoring@1.7",
  "output_contract": "normalized-model@2.5",
  "output_authority": {
    "family": "normalized-model",
    "version": "2.5",
    "semantic_contract_fingerprint": "scf:v1:sha256:bb48720502668e434d378445004aec7783346a0e74254c9e0d3cb01a8798d9d7"
  },
  "semanticDependencies": [
    "architecture-interpretation/1.3/lifecycle-ownership.schema",
    "authoring/1.7/schema/adr-common.schema",
    "authoring/1.7/schema/adr-logical.schema",
    "authoring/1.7/schema/adr-physical-base.schema",
    "authoring/1.7/schema/adr-physical-component.schema",
    "authoring/1.7/schema/adr-physical-system.schema",
    "authoring/1.7/schema/types.schema",
    "normalized-model/2.5/conformance",
    "normalized-model/2.5/schema/normalized-architecture-model.schema",
    "normalized-model/2.5/schema/normalized-entity-registry.schema",
    "normalized-model/2.5/schema/normalized-entity.schema",
    "normalized-model/2.5/schema/relationship-record.schema",
    "normalized-model/2.5/schema/relationship-registry.schema",
    "normalized-model/2.5/schema/unresolved-registry.schema"
  ],
  "rules": {
    "lifecycle": "literal_declaring_adr_status",
    "qualification_basis": "independently_verified_sealed_minimal_source_roots",
    "owner_identity": "declaring_ADR_canonical_UUIDv7_from_id",
    "reference_only": "never_a_definition_or_declaring_owner",
    "wildcard_meaning": "schema_items_only_not_runtime_identity_or_order",
    "missing_lifecycle_provenance": "Unavailable",
    "ambiguous_or_competing_established_ownership": "Rejected",
    "unqualified_rule_or_authority": "Unavailable",
    "unresolved_dependency": "Unresolved_only_if_governed_resolution_established_it",
    "partial_interpretation": "never_a_complete_qualified_result",
    "precedence": [
      "Rejected",
      "Unavailable",
      "Unresolved"
    ],
    "not_implied": [
      "implementation",
      "deployment",
      "operation",
      "effectivity",
      "admission",
      "independent_child_approval"
    ],
    "excluded": [
      "entity/normative_proposition",
      "entity/extension",
      "relationship/*",
      "value/*",
      "unqualified_standalone_fragment"
    ],
    "forbidden_owner_derivation": [
      "filename",
      "path",
      "source_pointer",
      "array_index",
      "traversal_order",
      "root_position",
      "request_key",
      "reference"
    ],
    "source_bytes": "unchanged",
    "canonical_identities": "preserved_no_new_identity",
    "additional_composition_bindings": false
  },
  "rows": [
    {
      "rule_id": "declaring-lifecycle.adr-logical.architectural_boundaries",
      "declaring_adr_semantic_type": "adr/logical",
      "parent_semantic_type": "adr/logical",
      "child_semantic_type": "entity/boundary",
      "source_schema": {
        "canonical_resource_key": "authoring/1.7/schema/adr-logical.schema",
        "content_digest": "sha256:32f6058dd5efc77cf6612587304f9275aa3a66bb7270fdb0f7ef4b871c9f5731",
        "schema_pointer": ""
      },
      "parent_schema": {
        "canonical_resource_key": "authoring/1.7/schema/adr-logical.schema",
        "content_digest": "sha256:32f6058dd5efc77cf6612587304f9275aa3a66bb7270fdb0f7ef4b871c9f5731",
        "schema_pointer": ""
      },
      "child_schema": {
        "canonical_resource_key": "authoring/1.7/schema/adr-common.schema",
        "content_digest": "sha256:f8d51b652285e8cdcefa19aa13c0cd76cb388fbdf86d3d32efe1470bd2606660",
        "schema_pointer": "/definitions/boundary"
      },
      "ownership_schema_path": [
        {
          "canonical_resource_key": "authoring/1.7/schema/adr-logical.schema",
          "content_digest": "sha256:32f6058dd5efc77cf6612587304f9275aa3a66bb7270fdb0f7ef4b871c9f5731",
          "schema_pointer": "/properties/architectural_boundaries/items"
        }
      ],
      "source_instance_pattern": "/architectural_boundaries/*",
      "declaring_adr_identity_selector": "/id",
      "parent_identity_selector": "/id",
      "child_identity_selector": "/id",
      "status_semantic_field_key": "adr/logical#/status",
      "status_source_authority": {
        "family": "authoring",
        "version": "1.7",
        "canonical_resource_key": "authoring/1.7/schema/adr-logical.schema",
        "content_digest": "sha256:32f6058dd5efc77cf6612587304f9275aa3a66bb7270fdb0f7ef4b871c9f5731",
        "schema_pointer": "/properties/status"
      },
      "governing_rule": "literal_declaring_adr_status",
      "value_destination": "/lifecycle_stage",
      "canonical_identity": "preserve_established_uuidv7",
      "shared_system_descriptor": "not_applicable"
    },
    {
      "rule_id": "declaring-lifecycle.adr-logical.capabilities",
      "declaring_adr_semantic_type": "adr/logical",
      "parent_semantic_type": "adr/logical",
      "child_semantic_type": "entity/capability",
      "source_schema": {
        "canonical_resource_key": "authoring/1.7/schema/adr-logical.schema",
        "content_digest": "sha256:32f6058dd5efc77cf6612587304f9275aa3a66bb7270fdb0f7ef4b871c9f5731",
        "schema_pointer": ""
      },
      "parent_schema": {
        "canonical_resource_key": "authoring/1.7/schema/adr-logical.schema",
        "content_digest": "sha256:32f6058dd5efc77cf6612587304f9275aa3a66bb7270fdb0f7ef4b871c9f5731",
        "schema_pointer": ""
      },
      "child_schema": {
        "canonical_resource_key": "authoring/1.7/schema/adr-common.schema",
        "content_digest": "sha256:f8d51b652285e8cdcefa19aa13c0cd76cb388fbdf86d3d32efe1470bd2606660",
        "schema_pointer": "/definitions/capability"
      },
      "ownership_schema_path": [
        {
          "canonical_resource_key": "authoring/1.7/schema/adr-logical.schema",
          "content_digest": "sha256:32f6058dd5efc77cf6612587304f9275aa3a66bb7270fdb0f7ef4b871c9f5731",
          "schema_pointer": "/properties/capabilities/items"
        }
      ],
      "source_instance_pattern": "/capabilities/*",
      "declaring_adr_identity_selector": "/id",
      "parent_identity_selector": "/id",
      "child_identity_selector": "/id",
      "status_semantic_field_key": "adr/logical#/status",
      "status_source_authority": {
        "family": "authoring",
        "version": "1.7",
        "canonical_resource_key": "authoring/1.7/schema/adr-logical.schema",
        "content_digest": "sha256:32f6058dd5efc77cf6612587304f9275aa3a66bb7270fdb0f7ef4b871c9f5731",
        "schema_pointer": "/properties/status"
      },
      "governing_rule": "literal_declaring_adr_status",
      "value_destination": "/lifecycle_stage",
      "canonical_identity": "preserve_established_uuidv7",
      "shared_system_descriptor": "not_applicable"
    },
    {
      "rule_id": "declaring-lifecycle.adr-logical.contracts",
      "declaring_adr_semantic_type": "adr/logical",
      "parent_semantic_type": "adr/logical",
      "child_semantic_type": "entity/contract",
      "source_schema": {
        "canonical_resource_key": "authoring/1.7/schema/adr-logical.schema",
        "content_digest": "sha256:32f6058dd5efc77cf6612587304f9275aa3a66bb7270fdb0f7ef4b871c9f5731",
        "schema_pointer": ""
      },
      "parent_schema": {
        "canonical_resource_key": "authoring/1.7/schema/adr-logical.schema",
        "content_digest": "sha256:32f6058dd5efc77cf6612587304f9275aa3a66bb7270fdb0f7ef4b871c9f5731",
        "schema_pointer": ""
      },
      "child_schema": {
        "canonical_resource_key": "authoring/1.7/schema/adr-common.schema",
        "content_digest": "sha256:f8d51b652285e8cdcefa19aa13c0cd76cb388fbdf86d3d32efe1470bd2606660",
        "schema_pointer": "/definitions/contract"
      },
      "ownership_schema_path": [
        {
          "canonical_resource_key": "authoring/1.7/schema/adr-logical.schema",
          "content_digest": "sha256:32f6058dd5efc77cf6612587304f9275aa3a66bb7270fdb0f7ef4b871c9f5731",
          "schema_pointer": "/properties/contracts/items"
        }
      ],
      "source_instance_pattern": "/contracts/*",
      "declaring_adr_identity_selector": "/id",
      "parent_identity_selector": "/id",
      "child_identity_selector": "/id",
      "status_semantic_field_key": "adr/logical#/status",
      "status_source_authority": {
        "family": "authoring",
        "version": "1.7",
        "canonical_resource_key": "authoring/1.7/schema/adr-logical.schema",
        "content_digest": "sha256:32f6058dd5efc77cf6612587304f9275aa3a66bb7270fdb0f7ef4b871c9f5731",
        "schema_pointer": "/properties/status"
      },
      "governing_rule": "literal_declaring_adr_status",
      "value_destination": "/lifecycle_stage",
      "canonical_identity": "preserve_established_uuidv7",
      "shared_system_descriptor": "not_applicable"
    },
    {
      "rule_id": "declaring-lifecycle.adr-logical.decisions",
      "declaring_adr_semantic_type": "adr/logical",
      "parent_semantic_type": "adr/logical",
      "child_semantic_type": "entity/decision",
      "source_schema": {
        "canonical_resource_key": "authoring/1.7/schema/adr-logical.schema",
        "content_digest": "sha256:32f6058dd5efc77cf6612587304f9275aa3a66bb7270fdb0f7ef4b871c9f5731",
        "schema_pointer": ""
      },
      "parent_schema": {
        "canonical_resource_key": "authoring/1.7/schema/adr-logical.schema",
        "content_digest": "sha256:32f6058dd5efc77cf6612587304f9275aa3a66bb7270fdb0f7ef4b871c9f5731",
        "schema_pointer": ""
      },
      "child_schema": {
        "canonical_resource_key": "authoring/1.7/schema/adr-common.schema",
        "content_digest": "sha256:f8d51b652285e8cdcefa19aa13c0cd76cb388fbdf86d3d32efe1470bd2606660",
        "schema_pointer": "/definitions/decision"
      },
      "ownership_schema_path": [
        {
          "canonical_resource_key": "authoring/1.7/schema/adr-logical.schema",
          "content_digest": "sha256:32f6058dd5efc77cf6612587304f9275aa3a66bb7270fdb0f7ef4b871c9f5731",